{
  "schemaVersion": 1,
  "exportKind": "phase14-sanitized-production-inventory",
  "environment": "fixture",
  "releaseSha": "598882e371a01c832832d7141acec918143c133c",
  "sourceKind": "local-fixture",
  "contentRecords": [
    { "recordKey": "content:activity:match", "recordKind": "activity", "migrationKey": "fixture:activity:match", "sourceIdentity": "source:activity:match", "publicationState": "draft", "visibility": "private", "metadataFingerprint": "aaaaaaaaaaaaaaaaaaaaaaaaaaaaaaaaaaaaaaaaaaaaaaaaaaaaaaaaaaaaaaaa", "relationshipFingerprint": "1111111111111111111111111111111111111111111111111111111111111111" },
    { "recordKey": "content:post:metadata-change", "recordKind": "post", "migrationKey": "fixture:post:metadata", "sourceIdentity": "source:post:metadata", "publicationState": "draft", "visibility": "private", "metadataFingerprint": "bbbbbbbbbbbbbbbbbbbbbbbbbbbbbbbbbbbbbbbbbbbbbbbbbbbbbbbbbbbbbbbb", "relationshipFingerprint": null },
    { "recordKey": "content:file:publication-change", "recordKind": "file", "migrationKey": "fixture:file:publication", "sourceIdentity": "source:file:publication", "publicationState": "published", "visibility": "public", "metadataFingerprint": "cccccccccccccccccccccccccccccccccccccccccccccccccccccccccccccccc", "relationshipFingerprint": null },
    { "recordKey": "content:activity:relationship-change", "recordKind": "activity", "migrationKey": "fixture:activity:relationship", "sourceIdentity": "source:activity:relationship", "publicationState": "draft", "visibility": "private", "metadataFingerprint": "dddddddddddddddddddddddddddddddddddddddddddddddddddddddddddddddd", "relationshipFingerprint": "2222222222222222222222222222222222222222222222222222222222222222" },
    { "recordKey": "content:faq:production-only", "recordKind": "faq", "migrationKey": null, "sourceIdentity": "source:faq:production-only", "publicationState": "visible", "visibility": "public", "metadataFingerprint": "eeeeeeeeeeeeeeeeeeeeeeeeeeeeeeeeeeeeeeeeeeeeeeeeeeeeeeeeeeeeeeee", "relationshipFingerprint": null },
    { "recordKey": "content:category:unknown", "recordKind": "category", "migrationKey": null, "sourceIdentity": "source:category:unknown", "publicationState": "unknown", "visibility": "unknown", "metadataFingerprint": "ffffffffffffffffffffffffffffffffffffffffffffffffffffffffffffffff", "relationshipFingerprint": null },
    { "recordKey": "content:post:duplicate-a", "recordKind": "post", "migrationKey": null, "sourceIdentity": "source:duplicate", "publicationState": "draft", "visibility": "private", "metadataFingerprint": "1212121212121212121212121212121212121212121212121212121212121212", "relationshipFingerprint": null },
    { "recordKey": "content:post:duplicate-b", "recordKind": "post", "migrationKey": null, "sourceIdentity": "source:duplicate", "publicationState": "draft", "visibility": "private", "metadataFingerprint": "1313131313131313131313131313131313131313131313131313131313131313", "relationshipFingerprint": null },
    { "recordKey": "content:activity-image:legacy", "recordKind": "activity-image", "migrationKey": null, "sourceIdentity": "source:legacy-image", "publicationState": "not-applicable", "visibility": "private", "metadataFingerprint": "1414141414141414141414141414141414141414141414141414141414141414", "relationshipFingerprint": null },
    { "recordKey": "content:activity-asset:one", "recordKind": "activity-asset", "migrationKey": null, "sourceIdentity": "source:asset:one", "publicationState": "not-applicable", "visibility": "private", "metadataFingerprint": "1515151515151515151515151515151515151515151515151515151515151515", "relationshipFingerprint": null },
    { "recordKey": "content:activity-video:one", "recordKind": "activity-video", "migrationKey": null, "sourceIdentity": "source:video:one", "publicationState": "not-applicable", "visibility": "restricted", "metadataFingerprint": "1616161616161616161616161616161616161616161616161616161616161616", "relationshipFingerprint": null },
    { "recordKey": "content:year-summary:one", "recordKind": "year-summary", "migrationKey": "fixture:year:one", "sourceIdentity": "source:year:one", "publicationState": "draft", "visibility": "private", "metadataFingerprint": "1717171717171717171717171717171717171717171717171717171717171717", "relationshipFingerprint": null },
    { "recordKey": "content:site-settings:singleton", "recordKind": "site-settings", "migrationKey": null, "sourceIdentity": "source:settings", "publicationState": "not-applicable", "visibility": "public", "metadataFingerprint": "1818181818181818181818181818181818181818181818181818181818181818", "relationshipFingerprint": null },
    { "recordKey": "content:editorial-target:one", "recordKind": "editorial-target", "migrationKey": "fixture:editorial:one", "sourceIdentity": "source:editorial:one", "publicationState": "draft", "visibility": "restricted", "metadataFingerprint": "1919191919191919191919191919191919191919191919191919191919191919", "relationshipFingerprint": null },
    { "recordKey": "content:editorial-redirect:one", "recordKind": "editorial-redirect", "migrationKey": null, "sourceIdentity": "source:redirect:one", "publicationState": "not-applicable", "visibility": "restricted", "metadataFingerprint": "2020202020202020202020202020202020202020202020202020202020202020", "relationshipFingerprint": null }
  ],
  "storageBuckets": [
    { "bucketId": "activity-assets", "visibility": "private", "fileSizeLimit": 20971520, "allowedMimeTypesFingerprint": "2121212121212121212121212121212121212121212121212121212121212121" },
    { "bucketId": "content-assets", "visibility": "private", "fileSizeLimit": 10485760, "allowedMimeTypesFingerprint": "2222222222222222222222222222222222222222222222222222222222222222" },
    { "bucketId": "downloads", "visibility": "private", "fileSizeLimit": 20971520, "allowedMimeTypesFingerprint": "2323232323232323232323232323232323232323232323232323232323232323" }
  ],
  "storageObjects": [
    { "objectKey": "object:match", "bucketId": "activity-assets", "pathRedacted": "activity-assets/<redacted>", "sourceIdentity": "source:asset:match", "checksumSha256": "2424242424242424242424242424242424242424242424242424242424242424", "sizeBytes": 1024, "visibility": "private", "metadataFingerprint": "2525252525252525252525252525252525252525252525252525252525252525" },
    { "objectKey": "object:checksum-change", "bucketId": "downloads", "pathRedacted": "downloads/<redacted>", "sourceIdentity": "source:asset:checksum", "checksumSha256": "2626262626262626262626262626262626262626262626262626262626262626", "sizeBytes": 2048, "visibility": "private", "metadataFingerprint": "2727272727272727272727272727272727272727272727272727272727272727" },
    { "objectKey": "object:orphan", "bucketId": "content-assets", "pathRedacted": "content-assets/<redacted>", "sourceIdentity": "source:asset:orphan", "checksumSha256": null, "sizeBytes": 512, "visibility": "private", "metadataFingerprint": "2828282828282828282828282828282828282828282828282828282828282828" },
    { "objectKey": "object:multiple-assignment", "bucketId": "activity-assets", "pathRedacted": "activity-assets/<redacted>", "sourceIdentity": "source:asset:multi", "checksumSha256": "2929292929292929292929292929292929292929292929292929292929292929", "sizeBytes": 4096, "visibility": "private", "metadataFingerprint": "3030303030303030303030303030303030303030303030303030303030303030" }
  ],
  "relationships": [
    { "relationshipKey": "relationship:match", "recordKey": "content:activity:match", "objectKey": "object:match", "sourceIdentity": "source:asset:match", "role": "cover", "assignmentOrdinal": 0, "relationshipFingerprint": "3131313131313131313131313131313131313131313131313131313131313131" },
    { "relationshipKey": "relationship:changed", "recordKey": "content:activity:relationship-change", "objectKey": "object:match", "sourceIdentity": "source:asset:match", "role": "gallery", "assignmentOrdinal": 0, "relationshipFingerprint": "3232323232323232323232323232323232323232323232323232323232323232" },
    { "relationshipKey": "relationship:accepted-skip", "recordKey": null, "objectKey": null, "sourceIdentity": "source:accepted-skip", "role": "accepted-skip", "assignmentOrdinal": 0, "relationshipFingerprint": "3333333333333333333333333333333333333333333333333333333333333333" },
    { "relationshipKey": "relationship:orphan", "recordKey": "content:missing-owner", "objectKey": "object:orphan", "sourceIdentity": "source:asset:orphan", "role": "unknown", "assignmentOrdinal": 0, "relationshipFingerprint": "3434343434343434343434343434343434343434343434343434343434343434" },
    { "relationshipKey": "relationship:multi:1", "recordKey": "content:activity:match", "objectKey": "object:multiple-assignment", "sourceIdentity": "source:asset:multi", "role": "gallery", "assignmentOrdinal": 0, "relationshipFingerprint": "3535353535353535353535353535353535353535353535353535353535353535" },
    { "relationshipKey": "relationship:multi:2", "recordKey": "content:post:metadata-change", "objectKey": "object:multiple-assignment", "sourceIdentity": "source:asset:multi", "role": "content-image", "assignmentOrdinal": 1, "relationshipFingerprint": "3636363636363636363636363636363636363636363636363636363636363636" }
  ],
  "redirectSourcePaths": [
    { "redirectKey": "redirect:accepted-out-of-scope", "sourcePathHash": "3737373737373737373737373737373737373737373737373737373737373737", "targetPathHash": "3838383838383838383838383838383838383838383838383838383838383838", "decision": "accepted-out-of-scope", "active": false, "metadataFingerprint": "3939393939393939393939393939393939393939393939393939393939393939" }
  ]
}
